{
  "schemaVersion": "sreagent.livereport/v1",
  "kind": "LiveReport",
  "metadata": {
    "name": "Third-Party Software Update Tracker",
    "description": "Third-party Windows application versions from Change Tracking (ConfigurationData, latest inventory per machine) compared numerically against an embedded vendor reference DB (2026-10-15). No embedded data; recommended for new environments.",
    "sourceReportId": null,
    "sourceVersion": null,
    "sourceAgent": null,
    "exportedAt": "2026-10-19T16:08:11Z",
    "exportedBy": "live_report_bundle.py 1.0.0 (clean)",
    "cleaned": {
      "placeholders": [
        "__RESOURCE_GROUP__",
        "__SUBSCRIPTION_ID__",
        "__WORKSPACE__"
      ],
      "pseudonymizedValues": 0,
      "replacements": 3,
      "leakScan": "pass",
      "jsSyntaxCheck": "pass"
    }
  },
  "spec": {
    "allowedTools": [
      "system-mcp-monitor_monitor_workspace_log_query"
    ],
    "html": "<!DOCTYPE html>\n<html lang=\"en\">\n<head>\n  <meta charset=\"UTF-8\">\n  <meta name=\"viewport\" content=\"width=device-width, initial-scale=1.0\">\n  <meta http-equiv=\"Content-Security-Policy\" content=\"\n    default-src 'none';\n    script-src 'self' 'nonce-{REPORT_NONCE}' https://cdn.jsdelivr.net https://cdnjs.cloudflare.com https://unpkg.com https://esm.sh;\n    style-src 'self' 'unsafe-inline' https://fonts.googleapis.com https://cdn.jsdelivr.net https://cdnjs.cloudflare.com;\n    font-src 'self' data: https://fonts.gstatic.com https://cdn.jsdelivr.net https://cdnjs.cloudflare.com;\n    img-src 'self' data: blob: https:;\n    connect-src 'self';\n  \">\n  <title>Third-Party Software Update Tracker</title>\n  <link rel=\"preconnect\" href=\"https://fonts.googleapis.com\">\n  <link rel=\"preconnect\" href=\"https://fonts.gstatic.com\" crossorigin>\n  <link href=\"https://fonts.googleapis.com/css2?family=Inter:wght@400;500;600;700&display=swap\" rel=\"stylesheet\">\n  <script src=\"https://cdn.jsdelivr.net/npm/chart.js@4.4.7/dist/chart.umd.min.js\" integrity=\"sha384-vsrfeLOOY6KuIYKDlmVH5UiBmgIdB1oEf7p01YgWHuqmOHfZr374+odEv96n9tNC\" crossorigin=\"anonymous\"></script>\n  <script src=\"https://cdn.jsdelivr.net/npm/chartjs-plugin-datalabels@2.2.0/dist/chartjs-plugin-datalabels.min.js\" integrity=\"sha384-y49Zu59jZHJL/PLKgZPv3k2WI9c0Yp3pWB76V8OBVCb0QBKS8l4Ff3YslzHVX76Y\" crossorigin=\"anonymous\"></script>\n  <script src=\"https://cdn.jsdelivr.net/npm/gridjs@6.2.0/dist/gridjs.umd.js\" integrity=\"sha384-y62I+ZvjNRolkugL/AMpUZykqrL6oqYxBruObmlDAhDpmapM0s+xgvVK+wGVpza0\" crossorigin=\"anonymous\"></script>\n  <link rel=\"stylesheet\" href=\"https://cdn.jsdelivr.net/npm/gridjs@6.2.0/dist/theme/mermaid.min.css\" integrity=\"sha384-i8iPOOXHyYKlqvjJjbORq7m/VrfUhgupTg3IZvtXz8M7c0CiTPUUhM5gdjiQiGbv\" crossorigin=\"anonymous\">\n  <style nonce=\"{REPORT_NONCE}\">\n    * { margin: 0; padding: 0; box-sizing: border-box; }\n    body {\n      font-family: 'Inter', -apple-system, BlinkMacSystemFont, 'Segoe UI', sans-serif;\n      background: #f8fafc; color: #1e293b; line-height: 1.5;\n      padding: 24px; max-width: 1400px; margin: 0 auto;\n    }\n    .header { margin-bottom: 24px; }\n    .header h1 { font-size: 22px; font-weight: 700; color: #0f172a; margin-bottom: 4px; }\n    .header .subtitle { font-size: 13px; color: #64748b; }\n    .header .subtitle span { margin-right: 16px; }\n    .loading-overlay {\n      position: fixed; inset: 0; background: rgba(248,250,252,0.92);\n      display: flex; align-items: center; justify-content: center;\n      z-index: 1000; flex-direction: column; gap: 12px;\n    }\n    .loading-overlay .spinner {\n      width: 36px; height: 36px; border: 3px solid #e2e8f0;\n      border-top-color: #3b82f6; border-radius: 50%;\n      animation: spin 0.8s linear infinite;\n    }\n    @keyframes spin { to { transform: rotate(360deg); } }\n    .loading-overlay .text { font-size: 14px; color: #64748b; font-weight: 500; }\n\n    /* Summary Cards */\n    .summary-row {\n      display: grid; grid-template-columns: repeat(auto-fit, minmax(180px, 1fr));\n      gap: 14px; margin-bottom: 24px;\n    }\n    .card {\n      background: #fff; border-radius: 10px; padding: 18px 20px;\n      border: 1px solid #e2e8f0; position: relative; overflow: hidden;\n    }\n    .card .label { font-size: 12px; font-weight: 600; text-transform: uppercase; letter-spacing: 0.5px; color: #64748b; margin-bottom: 6px; }\n    .card .value { font-size: 28px; font-weight: 700; }\n    .card .detail { font-size: 12px; color: #94a3b8; margin-top: 4px; }\n    .card.critical { border-left: 4px solid #dc2626; }\n    .card.critical .value { color: #dc2626; }\n    .card.warning { border-left: 4px solid #f59e0b; }\n    .card.warning .value { color: #f59e0b; }\n    .card.success { border-left: 4px solid #10b981; }\n    .card.success .value { color: #10b981; }\n    .card.info { border-left: 4px solid #3b82f6; }\n    .card.info .value { color: #3b82f6; }\n\n    /* Sections */\n    .section {\n      background: #fff; border-radius: 10px; border: 1px solid #e2e8f0;\n      margin-bottom: 20px; overflow: hidden;\n    }\n    .section-header {\n      padding: 16px 20px; border-bottom: 1px solid #f1f5f9;\n      display: flex; align-items: center; justify-content: space-between;\n      cursor: pointer; user-select: none;\n    }\n    .section-header:hover { background: #f8fafc; }\n    .section-header h2 { font-size: 15px; font-weight: 600; color: #0f172a; }\n    .section-header .badge {\n      font-size: 11px; font-weight: 600; padding: 3px 10px;\n      border-radius: 12px; color: #fff;\n    }\n    .badge-critical { background: #dc2626; }\n    .badge-warning { background: #f59e0b; }\n    .badge-info { background: #3b82f6; }\n    .badge-success { background: #10b981; }\n    .section-body { padding: 0; }\n    .section-body.collapsed { display: none; }\n\n    /* Priority Table */\n    .priority-table { width: 100%; border-collapse: collapse; font-size: 13px; }\n    .priority-table th {\n      text-align: left; padding: 10px 16px; background: #f8fafc;\n      font-weight: 600; color: #475569; font-size: 11px;\n      text-transform: uppercase; letter-spacing: 0.5px;\n      border-bottom: 1px solid #e2e8f0;\n    }\n    .priority-table td {\n      padding: 10px 16px; border-bottom: 1px solid #f1f5f9;\n      vertical-align: top;\n    }\n    .priority-table tr:last-child td { border-bottom: none; }\n    .priority-table tr:hover { background: #f8fafc; }\n    .risk-badge {\n      display: inline-block; font-size: 10px; font-weight: 700;\n      padding: 2px 8px; border-radius: 4px; text-transform: uppercase;\n      letter-spacing: 0.5px;\n    }\n    .risk-critical { background: #fef2f2; color: #dc2626; border: 1px solid #fecaca; }\n    .risk-high { background: #fff7ed; color: #ea580c; border: 1px solid #fed7aa; }\n    .risk-medium { background: #fffbeb; color: #d97706; border: 1px solid #fde68a; }\n    .risk-low { background: #eff6ff; color: #2563eb; border: 1px solid #bfdbfe; }\n    .risk-current { background: #f0fdf4; color: #16a34a; border: 1px solid #bbf7d0; }\n    .risk-unknown { background: #f8fafc; color: #64748b; border: 1px solid #e2e8f0; }\n\n    .machine-list {\n      display: flex; flex-wrap: wrap; gap: 4px; margin-top: 4px;\n    }\n    .machine-tag {\n      font-size: 11px; background: #f1f5f9; color: #475569;\n      padding: 1px 6px; border-radius: 3px; font-family: 'Inter', monospace;\n    }\n\n    /* Chart container */\n    .chart-container { padding: 20px; max-height: 500px; }\n    canvas { max-height: 460px; }\n\n    /* Grid.js overrides */\n    .gridjs-wrapper { border: none !important; border-radius: 0 !important; }\n    .gridjs-table { font-size: 13px !important; }\n    .gridjs-th { font-size: 11px !important; text-transform: uppercase !important; letter-spacing: 0.5px !important; }\n    .gridjs-footer { border-top: 1px solid #f1f5f9 !important; }\n    .gridjs-search { padding: 12px 16px !important; }\n    .gridjs-search-input { font-family: 'Inter', sans-serif !important; font-size: 13px !important; }\n\n    /* Version DB info */\n    .vdb-info {\n      padding: 16px 20px; font-size: 12px; color: #64748b;\n      background: #f8fafc; border-top: 1px solid #f1f5f9;\n    }\n    .vdb-info strong { color: #475569; }\n    .vdb-grid {\n      display: grid; grid-template-columns: repeat(auto-fill, minmax(280px, 1fr));\n      gap: 10px; margin-top: 10px;\n    }\n    .vdb-item {\n      background: #fff; border: 1px solid #e2e8f0; border-radius: 6px;\n      padding: 10px 14px; font-size: 12px;\n    }\n    .vdb-item .prod { font-weight: 600; color: #1e293b; }\n    .vdb-item .ver { color: #10b981; font-weight: 500; }\n    .vdb-item .date { color: #94a3b8; }\n\n    .error-box {\n      padding: 20px; text-align: center; color: #dc2626;\n      font-size: 13px; background: #fef2f2; border-radius: 8px;\n      margin: 16px;\n    }\n    .empty-state {\n      padding: 32px; text-align: center; color: #94a3b8; font-size: 13px;\n    }\n    .banner {\n      padding: 10px 14px; border-radius: 8px; font-size: 12px; margin-bottom: 10px;\n      border: 1px solid #fde68a; background: #fffbeb; color: #92400e;\n    }\n    .banner.info { border-color: #bfdbfe; background: #eff6ff; color: #1e40af; }\n    #banners { margin-bottom: 14px; }\n\n    .toggle-arrow { transition: transform 0.2s; font-size: 12px; color: #94a3b8; }\n    .toggle-arrow.collapsed { transform: rotate(-90deg); }\n\n    .footer {\n      margin-top: 24px; padding: 16px 0; border-top: 1px solid #e2e8f0;\n      font-size: 11px; color: #94a3b8; text-align: center;\n    }\n  </style>\n</head>\n<body>\n\n<div class=\"loading-overlay\" id=\"loading\">\n  <div class=\"spinner\"></div>\n  <div class=\"text\">Querying software inventory across fleet...</div>\n</div>\n\n<div class=\"header\">\n  <h1>Third-Party Software Update Tracker</h1>\n  <div class=\"subtitle\">\n    <span id=\"refreshTs\">Loading...</span>\n    <span>Source: Log Analytics / ConfigurationData (Windows applications, non-Micr